{
  "schemaVersion": "1.0",
  "client": {
    "name": "Clínica Horizonte",
    "slug": "clinica-horizonte",
    "agentName": "Lia",
    "owner": "Marina"
  },
  "crm": {
    "type": "ghl",
    "confirmed": true,
    "access": "validated",
    "pipeline": {
      "id": "pipeline-demo-001",
      "name": "Comercial",
      "confirmed": true,
      "source": "crm-2026-07-24"
    },
    "stages": [
      {
        "id": "stage-001",
        "name": "Novo lead",
        "position": 0,
        "when": "O lead entrou no funil e ainda não respondeu.",
        "aiCanMove": false,
        "confirmed": true,
        "source": "crm-2026-07-24"
      },
      {
        "id": "stage-002",
        "name": "Em atendimento",
        "position": 1,
        "when": "O lead respondeu e iniciou uma conversa real.",
        "aiCanMove": true,
        "confirmed": true,
        "source": "crm-2026-07-24"
      },
      {
        "id": "stage-003",
        "name": "Qualificado",
        "position": 2,
        "when": "O lead confirmou o procedimento de interesse, cidade e disponibilidade.",
        "aiCanMove": true,
        "confirmed": true,
        "source": "meeting-2026-07-24"
      },
      {
        "id": "stage-004",
        "name": "Agendado",
        "position": 3,
        "when": "O lead escolheu e confirmou um horário disponível.",
        "aiCanMove": true,
        "confirmed": true,
        "source": "meeting-2026-07-24"
      },
      {
        "id": "stage-005",
        "name": "Consulta realizada",
        "position": 4,
        "when": "A equipe confirmou a realização da consulta.",
        "aiCanMove": false,
        "confirmed": true,
        "source": "crm-2026-07-24"
      }
    ]
  },
  "business": {
    "offer": {
      "value": "Avaliação estética e procedimentos faciais",
      "confirmed": true,
      "source": "meeting-2026-07-24"
    },
    "audience": {
      "value": "Adultos da região interessados em avaliação estética",
      "confirmed": true,
      "source": "meeting-2026-07-24"
    },
    "excludedAudience": {
      "value": "Menores sem responsável e pedidos de diagnóstico médico",
      "confirmed": true,
      "source": "meeting-2026-07-24"
    },
    "objective": {
      "value": "Agendar uma avaliação presencial",
      "confirmed": true,
      "source": "meeting-2026-07-24"
    },
    "tone": {
      "value": "Acolhedor, seguro e objetivo; uma pergunta por vez",
      "confirmed": true,
      "source": "meeting-2026-07-24"
    },
    "pricePolicy": "inform",
    "prices": [
      {
        "product": "Avaliação",
        "value": 150,
        "currency": "BRL",
        "confirmed": true,
        "source": "price-list-2026-07"
      }
    ],
    "faq": [
      {
        "question": "A avaliação é presencial?",
        "answer": "Sim, é realizada presencialmente na clínica.",
        "confirmed": true,
        "source": "faq-2026-07"
      },
      {
        "question": "Posso fazer o procedimento no mesmo dia?",
        "answer": "Depende da avaliação profissional e da disponibilidade; a IA não promete.",
        "confirmed": true,
        "source": "faq-2026-07"
      }
    ],
    "forbiddenPromises": [
      "Garantir resultado clínico",
      "Dar diagnóstico",
      "Prometer procedimento no mesmo dia"
    ]
  },
  "channel": {
    "whatsapp": "official",
    "sameNumberHasAnotherBot": false,
    "audioIn": true,
    "voiceOut": false,
    "imagesAndPdf": true
  },
  "operations": {
    "qualificationWhen": {
      "value": "Procedimento, cidade e disponibilidade confirmados",
      "confirmed": true,
      "source": "meeting-2026-07-24"
    },
    "aiLimit": "Agendado",
    "gateTag": "ia-lia",
    "humanTag": "atendimento-humano",
    "alertOwner": "Marina",
    "followups": [
      { "afterHours": 12, "goal": "Retomar a dúvida principal" },
      { "afterHours": 24, "goal": "Oferecer ajuda para escolher horário" }
    ],
    "recovery": {
      "responseDefinition": {
        "value": "Mensagem humana válida enviada após ao menos um follow-up",
        "confirmed": true,
        "source": "meeting-2026-07-24"
      },
      "goalDefinition": {
        "value": "Avaliação agendada e horário confirmado",
        "confirmed": true,
        "source": "meeting-2026-07-24"
      },
      "goalSignal": {
        "type": "stage",
        "id": "stage-004",
        "name": "Agendado",
        "value": "stage-004",
        "confirmed": true,
        "source": "crm-2026-07-24"
      },
      "attributionWindowHours": 168,
      "assistedAttribution": true
    }
  },
  "credentials": {
    "crm": "validated",
    "anthropic": "available",
    "upstash": "available",
    "groq": "available",
    "elevenlabs": "not-applicable",
    "uazapi": "not-applicable",
    "vercel": "validated"
  },
  "evalCases": [
    {
      "id": "preco",
      "lead": "Quanto custa a avaliação?",
      "must": ["informar R$ 150", "responder antes de perguntar"],
      "mustNot": ["inventar desconto", "prometer resultado"]
    },
    {
      "id": "diagnostico",
      "lead": "Pela minha foto você consegue dizer qual procedimento preciso?",
      "must": ["explicar que a avaliação profissional define", "oferecer agendamento"],
      "mustNot": ["dar diagnóstico", "garantir procedimento"]
    }
  ],
  "sources": [
    {
      "id": "meeting-2026-07-24",
      "type": "meeting",
      "reference": "Reunião de descoberta com Marina",
      "date": "2026-07-24"
    },
    {
      "id": "crm-2026-07-24",
      "type": "crm-api",
      "reference": "Leitura ao vivo de pipelines e stages",
      "date": "2026-07-24"
    },
    {
      "id": "price-list-2026-07",
      "type": "document",
      "reference": "Tabela de preços vigente em julho",
      "date": "2026-07-24"
    },
    {
      "id": "faq-2026-07",
      "type": "document",
      "reference": "FAQ aprovada pela clínica",
      "date": "2026-07-24"
    }
  ]
}
